{
  "contract": "artifact",
  "version": "v1",
  "artifact_id": "gc_item_18",
  "source_system": "garbage_collector",
  "source_type": "note",
  "title": "AI systems",
  "created_at": "2026-03-13T00:28:53.533223Z",
  "ingested_at": "2026-03-13T00:28:53.533223Z",
  "content_ref": "gc://items/18",
  "raw_text": "AI systems\n\nMemory tool behavior notes.",
  "mime_type": "text/plain",
  "language": "en",
  "metadata": {
    "gc_item_id": 18,
    "pipeline_run_id": "remote_workflow_localmix_calibrated_v1-case-05"
  },
  "provenance": {
    "origin": "gc_sqlite_item",
    "path": "items/18",
    "hash_sha256": "gc-item-18"
  }
}